{
  "$schema": "https://json-schema.org/draft/2020-12/schema",
  "$id": "research/solver-assurance-and-gradients/schemas/experiment_provenance.schema.json",
  "title": "Track2ExperimentProvenance",
  "type": "object",
  "required": [
    "repository_commit",
    "dirty_worktree",
    "scenario_corpus_version",
    "python_version",
    "operating_system",
    "backend",
    "solver_settings",
    "random_seeds",
    "tolerances",
    "exact_command",
    "start_time_utc"
  ],
  "properties": {
    "repository_commit": { "type": ["string", "null"] },
    "dirty_worktree": { "type": "boolean" },
    "scenario_corpus_version": { "type": "string" },
    "solver_distribution": { "type": ["string", "null"] },
    "solver_version": { "type": ["string", "null"] },
    "package_source": { "type": ["string", "null"] },
    "package_hash": { "type": ["string", "null"] },
    "python_version": { "type": "string" },
    "operating_system": { "type": "string" },
    "cpu_info": { "type": ["string", "null"] },
    "gpu_info": { "type": ["string", "null"] },
    "cuda_runtime": { "type": ["string", "null"] },
    "cuda_driver": { "type": ["string", "null"] },
    "backend": { "type": "string" },
    "algorithm": { "type": ["string", "null"] },
    "solver_settings": { "type": "object" },
    "random_seeds": { "type": "object" },
    "batch_size": { "type": ["integer", "null"] },
    "warm_start_policy": { "type": ["string", "null"] },
    "tolerances": { "type": "object" },
    "fallback_policy": { "type": ["string", "null"] },
    "exact_command": { "type": "string" },
    "start_time_utc": { "type": "string" },
    "completion_time_utc": { "type": ["string", "null"] },
    "output_artifact_hashes": { "type": "object" },
    "extra": { "type": "object" }
  },
  "additionalProperties": true
}
